{
  "schema_version": "1",
  "bundle_b64": "eyJtZWRpYVR5cGUiOiAiYXBwbGljYXRpb24vdm5kLmRldi5zaWdzdG9yZS5idW5kbGUudjAuMytqc29uIiwgInZlcmlmaWNhdGlvbk1hdGVyaWFsIjogeyJjZXJ0aWZpY2F0ZSI6IHsicmF3Qnl0ZXMiOiAiTUlJRG9qQ0NBMGVnQXdJQkFnSVVYWCtaSjZYU1grcDEreTFGMjEyYUZMTUxiVjR3Q2dZSUtvWkl6ajBFQXdJd1RURXRNQ3NHQTFVRUF3d2tkR2x1Wm05cGJDMWpiMjVtYjNKdFlXNWpaU0IwWlhOMElFWjFiR05wYnlCeWIyOTBNUnd3R2dZRFZRUUtEQk4wYVc1bWIybHNMV052Ym1admNtMWhibU5sTUI0WERUSTJNREV3TVRBd01EQXdNRm9YRFRJMk1ERXdNVEF3TVRBd01Gb3dLakVvTUNZR0ExVUVBd3dmZEdsdVptOXBiQzFqYjI1bWIzSnRZVzVqWlNCMFpYTjBJSE5wWjI1bGNqQlpNQk1HQnlxR1NNNDlBZ0VHQ0NxR1NNNDlBd0VIQTBJQUJPZjNhZUlMT2FQZzlQUjUvdGl2U2JURkIvb1dJbzN3bmJnd1lQSWxoeTBLWWZONGptZHRNVGErRk0wQmNwTXpjL2lsV1ZDRU9IZ3RPTFdRR2J6OE1uZWpnZ0ltTUlJQ0lqQU1CZ05WSFJNQkFmOEVBakFBTUE0R0ExVWREd0VCL3dRRUF3SUhnREFUQmdOVkhTVUVEREFLQmdnckJnRUZCUWNEQXpBZEJnTlZIUTRFRmdRVWRFKzdHQkQxTndmM2t1M1N6VmFwanhxNm5xUXdId1lEVlIwakJCZ3dGb0FVZ2d5dCtqYUx1ejEyK1FuWjBJRTZyZmljVUQwd09RWUtLd1lCQkFHRHZ6QUJBUVFyYUhSMGNITTZMeTkwYjJ0bGJpNWhZM1JwYjI1ekxtZHBkR2gxWW5WelpYSmpiMjUwWlc1MExtTnZiVEFoQmdvckJnRUVBWU8vTUFFRkJCTjBhVzVtYjJsc2MyZ3ZkR1Z6ZEMxeVpYQnZNQjBHQ2lzR0FRUUJnNzh3QVFZRUQzSmxabk12YUdWaFpITXZiV0ZwYmpBN0Jnb3JCZ0VFQVlPL01BRUlCQzBNSzJoMGRIQnpPaTh2ZEc5clpXNHVZV04wYVc5dWN5NW5hWFJvZFdKMWMyVnlZMjl1ZEdWdWRDNWpiMjB3WlFZS0t3WUJCQUdEdnpBQkNRUlhERlZvZEhSd2N6b3ZMMmRwZEdoMVlpNWpiMjB2ZEdsdVptOXBiSE5vTDNSbGMzUXRjbVZ3Ynk4dVoybDBhSFZpTDNkdmNtdG1iRzkzY3k5eVpXeGxZWE5sTG5sdGJFQnlaV1p6TDNSaFozTXZkakV1TUM0d01JR0xCZ29yQmdFRUFkWjVBZ1FDQkgwRWV3QjVBSGNBenZ4UG9OMjFCSmhXNkxOcFdmRlVTMDVwUk5PV2hhVWtVMndxSDViMEx2OEFBQUdiZHR1U1lBQUFCQU1BU0RCR0FpRUExdlBEY3l0VEZiVDk2VEJ5bXp0cDBLSFFvMFhkcjd1NFgxbm52WkowSTlvQ0lRRGU3b2pRTzd2VWdDRG1UL3duZUx0M1Y5Y0J4eDFQbnV0NVA3ZC9PN1c3TkRBS0JnZ3Foa2pPUFFRREFnTkpBREJHQWlFQXU3ZVVuK09kNkpMQm90YkM2dVNLWENsVVViWUo1dFY5WUVKUzd4RGpVRG9DSVFEc253QThXWldYRFJPeXZsZDJyTElMWkZyZmJYdzBDWEJrNXhsdTlNRU9wdz09In0sICJ0bG9nRW50cmllcyI6IFt7ImxvZ0luZGV4IjogIjAiLCAibG9nSWQiOiB7ImtleUlkIjogIjAzQ0FtNUxLZG5ZRGswWnlEVUEvZUU0QzVCL1ZzQi9YWWtBQ016OHJZYlk9In0sICJraW5kVmVyc2lvbiI6IHsia2luZCI6ICJkc3NlIiwgInZlcnNpb24iOiAiMC4wLjEifSwgImludGVncmF0ZWRUaW1lIjogIjE3NjcyMjU3MjAiLCAiaW5jbHVzaW9uUHJvbWlzZSI6IHsic2lnbmVkRW50cnlUaW1lc3RhbXAiOiAiTUVVQ0lRRGpWNXZqK0tRclNDZWdkbkpJZGJZbEhQaGlQWmRJZ3dhc05ROGtWdUMvV0FJZ2FDTUFDMDJ6Mk9xbHpUV3d0cXdpMnY3dEJWZGZrRnNMbHFob05wRUhYSFE9In0sICJpbmNsdXNpb25Qcm9vZiI6IHsibG9nSW5kZXgiOiAiMCIsICJyb290SGFzaCI6ICJrbkdIU1JMVzN0VTZVWm1Ua3RTbi9BNFgzWW03YmhsUlFBRzFJM0VqUzdnPSIsICJ0cmVlU2l6ZSI6ICIxIiwgImhhc2hlcyI6IFtdLCAiY2hlY2twb2ludCI6IHsiZW52ZWxvcGUiOiAidGluZm9pbC1jb25mb3JtYW5jZVxuMVxua25HSFNSTFczdFU2VVptVGt0U24vQTRYM1ltN2JobFJRQUcxSTNFalM3Zz1cblxuXHUyMDE0IHRpbmZvaWwtY29uZm9ybWFuY2UgMDNDQW16QkZBaUFjd1h2eHo2Z05HeUJWekZ2NTV4YmNyTDJaRUZHNlVsRkFRbUJlblhpOU5nSWhBTXpIWWxBQmgyTWNNeThnTUo5R1h4QXl0R096MmhFWHEvUlBwK0N1anE0dlxuIn19LCAiY2Fub25pY2FsaXplZEJvZHkiOiAiZXlKaGNHbFdaWEp6YVc5dUlqb2lNQzR3TGpFaUxDSnJhVzVrSWpvaVpITnpaU0lzSW5Od1pXTWlPbnNpWlc1MlpXeHZjR1ZJWVhOb0lqcDdJbUZzWjI5eWFYUm9iU0k2SW5Ob1lUSTFOaUlzSW5aaGJIVmxJam9pTTJWaE1HRTFZMlExTjJRNVpqQTJaVGcyWlRBMU1UbGtNR05pWm1Oak1qTmlNR0ppTmpJM01EZG1Zak5qWTJJek5EaG1aR1kxTXpFek5qSTBaVEprT0NKOUxDSndZWGxzYjJGa1NHRnphQ0k2ZXlKaGJHZHZjbWwwYUcwaU9pSnphR0V5TlRZaUxDSjJZV3gxWlNJNklqWmpNMlZtTURnNE1tSTFOR1prTW1JMlpUWXlOMk5sTmpJNFpHTTBaVFkzTWpZMVkySTVZVGcyTnpVellqQXhaalF4TlRNeE1URmhaalZrTW1GalpUWWlmU3dpYzJsbmJtRjBkWEpsY3lJNlczc2ljMmxuYm1GMGRYSmxJam9pVFVWVlEwbENXbFJZUlZoUWFsTkhWbTVSSzNwclZXNWtlRXhCUTJaSlFteEJMeTlIWVV4bFFXaFVNRlF4VkU1MlFXbEZRWGhFVjFrM01URXhTbVkzVFRWVU4ySmlUbTVqY0dKNk5XaFhTV0V3YjNjeFJFbHpZelZ5VTJKcGVrVTlJaXdpZG1WeWFXWnBaWElpT2lKTVV6QjBURk14UTFKVlpFcFVhVUpFVWxaS1ZWTlZXa3BSTUVaVlVsTXdkRXhUTUhSRGF6RktVMVZTZG1GclRrUlJWRUpzV2pCR00xTlZTa0phTUd4V1YwWm5jbGRyYnpKWFJrNVpTek5CZUVzemEzaFNha2w0VFcxR1IxUkZNVTFaYkZrd1pEQk9ibGRWYkV4aU1YQktaVzF2ZDFKVlJqTlRXR05MVmtaU1JtUkZNVVJqTUdSQ1RWWldSbEZZWkROaE1sSklZa2hXWVdKVWJIZFphMDE0WVcxSmVVNVhNV2xOTUhBd1YxWmpNV0ZzY0ZSUmFrSmhWMFUwZDFOVlZtRk5WMHBJVkc1Q2FXVlZTalZaYWtrMVRVRndUbFZ1WkROU01tUmFVa1phVWxWVmRFVlJhelIzV1Zaak1XSlhTWGxpU0U1TlZqQTFNbGx0TVdGa2JVNTBUVmRvYVdKVk5YTlVWVWt3VjBWU1ZWTlVTazVTUlZZelZGWlNRbVF3TVVWUldHUk9VbTA1V1VOclVsVlRWRXBPVWtWV00xUldVa0prTURGVlVWaGtUbEp0T1ROVE1uQkdZakF4UkZkVlpFSk5WbFpHVVZoa00xcHRVa2hpU0ZaaFlsUnNkMWxyVFhoaGJVbDVUbGN4YVUwd2NEQlhWbU14WVd4d1ZGRnFRVXRYYkdoUFRVVnNTVlJ1UW1GTmFsWnpXVEp3UTFkck1VTlVWV1JEWlZoR1NGVXdNREJQVlVadVVsVmtSRkV6UmtoVk1EQXdUMVZHTTFKVmFFSk5SV3hDVVdzNWJVMHlSbXhUVlhoUVdWWkNiazlXUWxOT1VXOTJaRWRzTWxVeVNsVlNhMGwyWWpGa1NtSjZUak5pYlVwdVpERnNVVk5YZUc5bFZFSk1WMWRhVDA1SGNIUmFTRkpPVmtkRmNsSnJNSGRSYlU1M1ZGaHdha3d5YkhOV01WcEVVbFU1U1ZvelVsQlVSbVJTUTJ0a2FXVnFhRTVpYlZaeFdqSmtTbUpWTVVwVFZVNUtZV3RHVGxGdFpFOVdhMmhUVkZWS1FscHFhRVpSVjNCQ1VWVXhRazVGWkVKTlZsWnJVa2hrUmxGcE9UTlZWVlpDWkRCc1NWb3dVa0pXUlVwdVZHeFpTMU5HVGxaU1ZWSkZVVlYwUTFveVpIbFJiV1JHVW10S1Vsa3dVa0psYTBaclVXMWtUMVpyYUZKT1JWWkhXakZHVmxwRlZYSk9NR1JEVWtSR1QyUXlXWHBoTTFWNlZUTndWMWxZUW5GbFNFVXlZbTVHVW1SM2NFbGtNV3hGVm14SmQyRnJTa05hTTJSSFlqQkdWbG95WkRWa1EzUnhXVlY0TVdWcVJYbExNVVoxVjJwQ1NsSlVXbmxhYld4cVZsVlJkMlF3T1ZKWFZYUk1aREZzUTFGclJraFNTRm8yVVZWS1FsVldSbmxEYlVaSlZXcENhbE5GTURKVVNHczFUVWRKZVdSSGVHbGhWRlp2VjFST1UyTkhTWGxPV0hCTllsZFNkMXBGWkc5TlZteDFWbTV3WVZkRmNIRlpha2t4VFVad1dFNVVRazFpVlRVeVdXeFNRbUZGU201aU0wbExVVzFrUmxKVlJscFVlVGxPVVZWV1IxRnJTazlOUjBaWVRsY3hhVTF0ZUhwWmVrcHVaRzFTU0ZadWNHdFJla1kxVjJ4b1EyUnJNVU5OUldSRVlWaE9TRkZXUmxKUmJXTXpUMGhrUWxWV2JFWlNSRTVMWWtGd1lXSnJNVEpaVldSWFlVWndTVlJZV21sV01GcDNXVzF3UWs0d1NtNWlNMHBEV2pCV1JsRldiRkJNTURGQ1VsVnNRMUY2UWs1VGVrcHZUVWRTU1ZGdWNGQmhWR2d5V2tWak5XTnNjRmhPU0ZaYVZqQTBkME50UmxoUFdGWnFaVlJXZFZsV2FGTmlNbEpZVTJwR2FrMXNXalZYVkVrMVpGZFNTRlp1Vm10UmVsWnhXV3BKZDJReGNGSlhWWFJNWkRGc1ExRnJSa2hTU0ZvMlVWVktSRlZXU2xsU1JWcFhZakpTU1ZWdVkwdFpNM0IyWkd0M2VWcElRbXRTTW1kNFYxZHJNV0Z0U1hsTlNGcHJVako0TVZkdE1EVmpSMHBKVkcwNVRVMHhTbk5aZWs1U1pFZE9kRlp1WkdsbFZHZ3hWMnBLYzAxSFJrbFdiV3hOVFRKU01sa3lNVEJpVVhCcFVucHJlbGt6YXpWbFZuQllaVWQ0V2xkRk5YTlVSelZ6WkVkS1JsRnViR0ZXTVhBMlZFUk9VMkZHYjNwVVdGcHJZV3RXTVZSVlRUQmtNREZLVWpCNFExb3lPWGxSYldSR1VsVkdhMWRxVmtKYU1VWkVRMnRLU1UxRlZteGtNRWt4VVZWb2FsRlljREpsUmtKMlZHcEplRkZyY0c5V2VscE5WRzVDV0ZwcldsWlZla0V4WTBaS1QxUXhaRzlaVmxaeVZsUktNMk5WWnpGWmFrSk5aR3BvUWxGVlJraFpiVkl3WkZaTlMxZFZSa0pSVlVwQ1ZGVkdWRkpGU2toUlYyeEdVVlJHTWxWRlVtcGxXRkpWVW0xS1ZVOVVXbFZSYm14MFpXNVNkMDFGZEVsVlZ6aDNWMGRTZVU0elZUQlhSRVoxWW01YVlWTnFRa3BQVnpsRVUxWkdSVnBSYnpOaU1uQlNWSHBrTWxaWFpFUlNSekZWVEROa2RWcFZlREJOTVZrMVdUQktOR1ZFUmxGaWJsWXdUbFpCTTFwRE9WQk9NV016Vkd0U1FsTXdTbTVhTTBadllUSndVRlZHUmxKU1JVWnVWR3R3UWxKRlNraERhMFp3VWxWR01VNHlWbFppYVhSUVdrUmFTMVJGU25aa1IwcEVUbTVXVkZNeGFFUmlSbFpXV1d4c1MwNVlVbGRQVm14R1UyeE5NMlZGVW5GV1ZWSjJVVEJzVWxKSVRuVmtNRVUwVmpGd1dGZEZVbE5VTTJ0TFpHMTRhMDF1U2sxVFZYaGhVbTVLYlZsc2FETk5SVTVaVVcxek1XVkhlREZQVlRGR1ZETkNNMUJVTUV0TVV6QjBURk14UmxSclVXZFJNRlpUVmtWc1IxTlZUa0pXUlZWMFRGTXdkRXhSYnowaWZWMTlmUT09In1dfSwgImRzc2VFbnZlbG9wZSI6IHsicGF5bG9hZFR5cGUiOiAiYXBwbGljYXRpb24vdm5kLmluLXRvdG8ranNvbiIsICJwYXlsb2FkIjogImV5SmZkSGx3WlNJNkltaDBkSEJ6T2k4dmFXNHRkRzkwYnk1cGJ5OVRkR0YwWlcxbGJuUXZkakVpTENKemRXSnFaV04wSWpwYmV5SnVZVzFsSWpvaWRHbHVabTlwYkMxa1pYQnNiM2x0Wlc1MExtcHpiMjRpTENKa2FXZGxjM1FpT25zaWMyaGhNalUySWpvaU5XVmtPV1ExWXprME1qVXlPR1ZqTW1WbFlqYzFPVGt4T1RneU4yWXhZbU15TVRnell6WTRNVEJtT0RBeU1qVmhOVEl4TkRka1pEUXdNakJqTVRKaE1DSjlmVjBzSW5CeVpXUnBZMkYwWlZSNWNHVWlPaUpvZEhSd2N6b3ZMM1JwYm1admFXd3VjMmd2Y0hKbFpHbGpZWFJsTDNOdWNDMTBaSGd0YlhWc2RHbHdiR0YwWm05eWJTOTJNU0lzSW5CeVpXUnBZMkYwWlNJNmV5SnpibkJmYldWaGMzVnlaVzFsYm5RaU9pSXdPV1ZtTXpKaFkyWTVNR1pqWm1WaU5qSXdObVF4WVRRMll6RXpNVFExWTJWbU56TTJaV0ppWWpnelpqRTRaV0ZtWmpZNE1HSTJPRFl5TXpJd016RTFORFptWmpWbVpETTVZelEwTlRrNU5qazVaV1U0TnpNMFkySmlaV0kxTVRraUxDSjBaSGhmYldWaGMzVnlaVzFsYm5RaU9uc2ljblJ0Y2pFaU9pSmhOMlZrTVdKalltVTJPVFl5TWpKbFkyWTVOVFptTW1NM09HRXpZakk1Wm1Oak9HTmhNalE0TXpGaE5EYzFNV0kxT0dZMU9EVTRaRFV6TjJaaVpqSTVOalkyWlRjNU5EbGxPRFF3TWpVNU9XTTVObVkwTVdFNE1HWTNabVV5TlRNaUxDSnlkRzF5TWlJNkltUmtZMlV6Tm1NM1ltVmlaamcwTVdJellUUm1aakJqT0dNeVpHWTJNemcyT1dZeE1ESmlOelE1TURRd05qTmxabU15TkRJME5HSm1OV0k1T0ROaU5EUmxPRGRtTmpFd1l6Y3paamsyTTJKa00yVTROVGt3TVRRNU1ETTFNRGhqTXlKOUxDSmpiV1JzYVc1bElqb2ljbVZoWkc5dWJIazliMjRnY0dOcFBYSmxZV3hzYjJNc2JtOWpjbk1nYlc5a2NISnZZbVV1WW14aFkydHNhWE4wUFc1dmRYWmxZWFVnYm05MWRtVmhkUzV0YjJSbGMyVjBQVEFnY205dmREMHZaR1YyTDIxaGNIQmxjaTl5YjI5MElISnZiM1JvWVhOb1BUQXdZbUl5Wm1ZNE1XVXhNV1kyWldWbE56TTNZekUyTmpSbE1EVm1PVFUyWXpJd1lXWmxPVGt3TXpNM1l6azNNMkZqWW1JeE0yRmtNakJqWWpVNE1tWWdkR2x1Wm05cGJDMWpiMjVtYVdjdGFHRnphRDFqTTJaaFlqVmlNbU5tWWpsaE16a3pOREV6WmpReVl6WXpObVUxWTJFeU16VXpPR1ZqT0dWalltVTFObUUyWkRJNU56QXdPR014WlRBME5qUXdNV05rSWl3aWFHRnphR1Z6SWpwN0luWmxjbk5wYjI0aU9pSjJNQzQxTGpFMklpd2ljbTl2ZENJNklqQXdZbUl5Wm1ZNE1XVXhNV1kyWldWbE56TTNZekUyTmpSbE1EVm1PVFUyWXpJd1lXWmxPVGt3TXpNM1l6azNNMkZqWW1JeE0yRmtNakJqWWpVNE1tWWlMQ0pwYm1sMGNtUWlPaUppT1RjNU1qZGlPREZqT0RJd016TTRNV1E0T1dObFpEaGtPVEJsTnpneVlqRmtPRGRoWlRObE5tSTNNV1kxTWpNM01HSmhPREZoWldKaE1tRmtaV1F4SWl3aWEyVnlibVZzSWpvaU16bGpZek5rT1Rka05ERTFaRGs1TlRJek56VTBZV1l3TWpBelpqTTVOVEZtWVROaVptUmhZMlUxWmpNek9EYzVNalpqWTJZeVlUZG1aRFJtWXpobU1DSXNJbkpoZHlJNklqRTFNMkppTTJWaFlXRmpOamMyTlRNNE5EYzJPR1F5T0RrME1URTNZemRpTUdaaE9XSmtaV0UyWVdVeFpqZzRPV0psWVRaaVlXSTNNMkpsWkRJNE5EZ2lMQ0ppZFdsc2RGOWhkQ0k2SWpJd01qWXRNREV0TVRWVU1ETTZNalU2TXpsYUluMHNJbU52Ym1acFp5STZJbU15YUhCaVV6RXlXbGhLZW1GWE9YVlBhVUl5VFVNMGVreHFSWGRSU0U1dldWUkpNVTVxYnpSTmFsWnFXbTFHYlZsdFRUSmFSMUpzVDBSck1rNHlSbXBPYWtKc1RrUlJlVTVxVW0xT1JGazBUbTFhYWxwcVNteGFSRTE2V20xR2JFMVVSWGxaVjBrd1dXcEdhazVxYkdwT2Fsa3pUVEpPYTFsNmFHeERiVTR5WWxNeE1scFlTbnBoVnpsMVQybEJkMHhxVlhWTlZGbExXVE5DTVdONmIyZFBRWEIwV2xjeGRtTnVhelpKUkVVeVRYcG5NRU5uY0hwaFIyeDBUMmR2WjBsSGVIQmpNMUpzWW1reGQySXpTakJQYVVFd1RrUk5TMGxEUWpGalNFNHdZMjFXYUdKVE1YZGlNMG93VDJsQk5FMUVaelZEWjNCcVlqSTFNRmxYYkhWYVdFcDZUMmR2WjBsRE1HZGliVVowV2xSdlowbHVRbmxpTTJnMVNXZHZaMGxEUVdkaFZ6Rm9XakpWTmtsRFNXbERhVUZuU1VOQ2FHTnRaSHBQYVVKaVEybEJaMGxEUVdkSlEwcHVZVWRPZVV4dGJIWk1NMUp3WW0xYWRtRlhlSHBoUXpscVlqSTFiV0ZYVW14aWJsSndXVmQzZEdKWE9XdGFWM2QwWTIwNU1XUkhWbmxQYWtGMVRVTTBlazlEU1hORGFVRm5TVU5CWjBsRFNYUmFRMGx6U1dsUmIxbFlaSEpKUXpGSFNucHZaMHRwWTJkS2VWRjRabWs1WlZwSE9YUlpWMngxU2tNNU4yTklTbkJpYmxGblNrUkpOMGxIVmpSaFdGSTVTbmxCZG1KWE5UQk1NMHBvWWxkU2NHTXljM1phV0dnd1dsaEtkVmxYZDNSWk1qbDFXbTFzYmt4dWJIUmlRMnRwVEVGdlowbERRV2RZVVc4OUluMTkiLCAi